{
  "schema_version": "1.0",
  "package_id": "FEP-ringmoclaw",
  "source_sha256": "32df5e2843de7e8ccd52d56b9dfed257c26786ef3b71fbc397a1c3a5e26fb0fa",
  "base_model_sha256": "0e934ab6c66b0df75589cc4c32204686e78090618b184d1e1e662c145fbf09d3",
  "created_at": "2026-10-14T12:24:50.505758+00:00",
  "frozen": true,
  "evidence": [
    {
      "id": "A01",
      "kind": "assumption",
      "record": {
        "id": "A01",
        "text": "假定评测基准数据分布与真实遥感任务具备一致性",
        "page": 4
      }
    },
    {
      "id": "B01",
      "kind": "limitation",
      "record": {
        "id": "B01",
        "text": "实验评测主要集中在遥感图像模式识别任务，多模态与时序扩展及多智能体通信开销仍待优化",
        "page": 15
      }
    },
    {
      "id": "C01",
      "kind": "claim",
      "record": {
        "id": "C01",
        "statement": "RingMoClaw 通过异构 Critic 与双流动态经验总线，在遥感多任务自演化探索中实现了超越基线模型与对标开源框架的探索效率与精度增益。",
        "page": 2,
        "evidence": [
          "F01",
          "F02",
          "F04",
          "F05",
          "T01",
          "T06",
          "T07",
          "T08",
          "T09",
          "T10"
        ],
        "epistemic": "SUPPORTED",
        "evidence_scope": "IN_PAPER_EVIDENCE",
        "observation": "在 FAIR1M 等多项基准上测得检测精度提升与算力耗时压减。",
        "author_interpretation": "作者认为双流经验与 Critic 机制形成了有效自演化闭环。",
        "reader_assessment": "在论文所列 4 类遥感视觉任务配置下得到实验证据支持。"
      }
    },
    {
      "id": "F01",
      "kind": "figure",
      "page": 2,
      "label": "Fig. 1",
      "caption": "Fig. 1: Comparison of existing remote sensing research agents and RingMoClaw. RingMoClaw introduces a unified research loop with independent critique and dual-stream experience evolution for continuous model improvement.",
      "file": "assets/figures/fig01_p2_3988x2475.png",
      "parsed_cells": null
    },
    {
      "id": "F02",
      "kind": "figure",
      "page": 4,
      "label": "Fig. 2",
      "caption": "Fig. 2: Overall architecture of RingMoClaw. The self-evolving research pipeline (left) and the Critic pipeline (right) are coupled through a dual-stream dynamic experience bus (center), which integrates external knowledge flow and internal experimental flow to support automated research iteration and the continuous refinement of the structured search space.",
      "file": "assets/figures/fig02_p4_4594x1975.png",
      "parsed_cells": null
    },
    {
      "id": "F03",
      "kind": "figure",
      "page": 6,
      "label": "Fig. 3",
      "caption": "Fig. 3: Object-detection workflow of the proposed framework. The research pipeline performs staged model optimization, while the Critic mechanism reviews intermediate outputs and returns feedback for strategy revision and experience accumulation.",
      "file": "assets/figures/fig03_p6_2481x2264.png",
      "parsed_cells": null
    },
    {
      "id": "F04",
      "kind": "figure",
      "page": 7,
      "label": "Fig. 4",
      "caption": "Fig. 4: Illustration of the Critic mechanism. The Critic mechanism intervenes at three key nodes of the execution chain, namely the plan review, the data review, and the result review. All feedback is routed through the Main Agent for global coordination, and every iteration is written into the global experience pool after standardization.",
      "file": "assets/figures/fig04_p7_1684x1946.png",
      "parsed_cells": null
    },
    {
      "id": "F05",
      "kind": "figure",
      "page": 8,
      "label": "Fig. 5",
      "caption": "Fig. 5: Dual-stream dynamic experience bus for autonomous research evolution. External knowledge from literature and code and internal experience from task memory and cross-task memory are integrated into global and local experience pools. The experience bus dynamically prunes and expands the structured search space, guides candidate scheme instantiation, and updates the main agent through agile verification, thereby transforming blind trial-and-error search into experience-guided optimization toward task-specific solutions.",
      "file": "assets/figures/fig05_p8_4400x1393.png",
      "parsed_cells": null
    },
    {
      "id": "F06",
      "kind": "figure",
      "page": 10,
      "label": "Fig. 6",
      "caption": "Fig. 6: Weak categories detection results on FAIR1M across different evolution stages. From left to right: (1) Baseline, (2) Data Augmentation, (3) Training Strategy Optimization, (4) Two-Stage Few-Shot Detection, (5) Multi-Model Fusion, and (6) Module Innovation. Green boxes denote true positives (TP) of base categories; yellow/purple boxes denote true positives (TP) of weak/rare categories; red boxes denote false negatives (FN, missed detections); and pink boxes denote false positives (FP, incorrect detections). The figure illustrates how progressive improvements in architecture and module design reduce both missed detections and false positives, particularly for weak categories, highlighting the effectiveness of the proposed RingMoClaw Auto-Research framework in addressing long-tail fine-grained detection challenges.",
      "file": "assets/figures/fig07_p10_4401x2227.png",
      "parsed_cells": null
    },
    {
      "id": "F07",
      "kind": "figure",
      "page": 10,
      "label": "Fig. 7",
      "caption": "Fig. 7: Training behavior of the final detector on FAIR1M. (a) Training and validation loss curves over 20 epochs. (b) Mean precision-recall curve over the 37 object categories.",
      "file": "assets/figures/fig08_p10_1482x1739.png",
      "parsed_cells": null
    },
    {
      "id": "F08",
      "kind": "figure",
      "page": 11,
      "label": "Fig. 8",
      "caption": "Fig. 8: Class activation map visualization of the baseline classifier and the candidate classifiers selected for score-level fusion on representative weak categories of NWPU-RESISC45. Different candidate models attend to different discriminative regions, indicating clear complementary behavior across scene categories.",
      "file": "assets/figures/fig10_p11_3665x1903.png",
      "parsed_cells": null
    },
    {
      "id": "F09",
      "kind": "figure",
      "page": 13,
      "label": "Fig. 9",
      "caption": "Fig. 9: Per class recall on weak categories of FAIR1M for the baseline and three single technique variants. Each variant adds one technique to the baseline: a class aware sampler, a focal loss, and a BFPA attention module.",
      "file": "assets/figures/fig15_p13_1384x1140.png",
      "parsed_cells": null
    },
    {
      "id": "T01",
      "kind": "table",
      "page": 9,
      "label": "TABLE I",
      "caption": "TABLE I: OBJECT DETECTION RESULTS ON FAIR1M (%). OVERALL MAP50 AND PER-CATEGORY AP ARE REPORTED FOR SELECTED WEAK CATEGORIES. REPRESENTATIVE DETECTORS ARE COMPARED WITH THE BASELINE AND SUCCESSIVE EVOLUTION STAGES OF RINGMOCLAW. BEST RESULTS ARE IN BOLD.",
      "file": "assets/figures/crop_T01_p9_923x898.png",
      "parsed_cells": [
        [
          "Method",
          "C5 C10 C11 C14"
        ],
        [
          "mAP50"
        ],
        [
          "Gliding Vertex [51]",
          "29.92 0.01 0.01 9.12 15.67"
        ],
        [
          "RetinaNet [49]",
          "30.67 0.81 1.70 9.57 16.37"
        ],
        [
          "Cascade R-CNN [52]",
          "31.18 0.00 0.00 12.10 15.35"
        ],
        [
          "Faster R-CNN [53]",
          "32.12 0.01 0.13 9.81 17.65"
        ],
        [
          "RoI Transformer [54]",
          "35.29 0.00 0.00 14.31 14.32"
        ],
        [
          "OFA-Net [55]",
          "43.73 30.71 29.25 9.90 30.37"
        ],
        [
          "Oriented R-CNN [56]",
          "44.30 25.55 32.85 20.46 32.89"
        ],
        [
          "RingMoClaw evolution"
        ],
        [
          "Baseline (Train & Infer) 47.30 51.74 32.56 31.11 20.29"
        ],
        [
          "Data Augmentation",
          "48.18 51.94 34.76 31.14 21.89"
        ],
        [
          "Training Config Update 47.77 51.83 35.06 31.13 23.90"
        ],
        [
          "Few-Shot Training",
          "47.69 51.92 35.15 31.58 24.11"
        ],
        [
          "Multi-Model Fusion",
          "49.11 53.87 36.27 32.87 26.60"
        ],
        [
          "Module Innovation",
          "49.14 54.14 36.36 33.16 26.89"
        ],
        [
          "Note: C5: C919; C10: ARJ21; C11: Passenger Ship; C14: Tugboat; C24: Trailer; C25: Tractor; C26:"
        ],
        [
          "pretraining data and reasoning style, which keeps the review patches with an"
        ],
        [
          "branch heterogeneous with respect to the execution chain.",
          "random resizing,"
        ],
        [
          "Object detection. We report mean average precision for data"
        ],
        [
          "(mAP50) as the evaluation metric. The baseline detector rate of 6 × 10−5"
        ],
        [
          "adopts a YOLO11x-OBB oriented detection head, following 1,500-iteration"
        ],
        [
          "the FAIR1M detection setting in [5]. On FAIR1M-v1.0, high- All models are"
        ],
        [
          "resolution images are cropped into 512 × 512 patches with size of 16 using"
        ]
      ]
    },
    {
      "id": "T02",
      "kind": "table",
      "page": 11,
      "label": "TABLE II",
      "caption": "TABLE II: SCENE CLASSIFICATION RESULTS ON NWPU-RESISC45 (%). THE TABLE REPORTS OVERALL ACCURACY AND PER-CATEGORY ACCURACY FOR SELECTED WEAK CATEGORIES. REPRESENTATIVE CLASSIFIERS ARE COMPARED WITH THE BASELINE AND FUSION STRATEGIES SELECTED BY RINGMOCLAW. BEST RESULTS ARE IN BOLD.",
      "file": "assets/figures/crop_T02_p11_790x449.png",
      "parsed_cells": [
        [
          "Method",
          "Acc",
          "C7 C10 C14"
        ],
        [
          "ConvNeXt-T [61]",
          "92.25 80.71 84.29 86.07"
        ],
        [
          "EfficientNet-B4 [62]",
          "92.08 77.86 93.93 87.86"
        ],
        [
          "ResNet50 [63]",
          "82.10 46.07 77.50 70.36"
        ],
        [
          "RingMoClaw Evolution"
        ],